Question,Answer
What are accruals?,"An accrual is a balance that reflects either revenue earned or expenses liable for, when cash has not been exchanged as yet. For example, if you buy a TV and have not paid the cash as yet, you would have an accrual for the value of the TV. When the cash is exchanged, the accrual is removed. If you are unsure how to calculate this figure, please contact your Finance Business Partner. 

You can find out who your Finance Business Partner is by reviewing the FBP Directory linked below: https://educationgovuk.sharepoint.com/sites/how-do-i/SitePages/finance-business-partners.aspx"
What is an accrual,"An accrual is a balance that reflects either revenue earned or expenses liable for, when cash has not been exchanged as yet. For example, if you buy a TV and have not paid the cash as yet, you would have an accrual for the value of the TV. When the cash is exchanged, the accrual is removed."
What are actual liabilities?,"An actual liability arises when the Department gives a specific guarantee, indemnity, letter or statement of comfort which results in a legal or moral responsibility on the Department to meet certain costs where the amounts and timing are known. As the Department is actually meeting the cost of these liabilities there is usually a provision for the future costs in the Resource Accounts."
How often do I need to complete my AFR? When do I need to complete my AFR by?,An AFR must be completed annually by each financial year end (31st March).
PAYE settlement agreement,"An agreement that allows the employer to make one annual payment to cover all the tax and National Insurance due on minor, irregular or impracticable expenses or benefits for the employees"
Allowance,An amount of something that is permitted within a set of regulations for a specified purpose
Asset,An asset is an economic resource controlled by the entity as a result of past events. An economic resource is a right that has the potential to produce economic benefits.
Non-current asset,An asset with lifespan of more than one year
What is audit opinion?,"An audit opinion is a professional opinion offered by an external auditor (NAO) at the close of an audit of financial records or by internal auditor (GIAA) at the close of an audit of risk management, governance and internal control processes."
Estimate memorandum,An explanation of how provision sought in the Estimate is intended to be used and the relationship with other spending controls. Primarily provided for the departmental select committee but made freely available online.
What is the income and expenditure account?,"An income and expenditure account is a financial statement that shows an entity's revenue, expenses and profit for a period of time."
External financial audit,An independent examination of statutory records and the departmental  Annual Report and Accounts to provide an opinion as to whether the financial statements present a true and fair view of the departmental accounts
Legacy loan,An inherited loan from another government department or SSCL
What is an intangible asset?,"An intangible asset is an asset that is not physical in nature. Corporate intellectual property, including items such as patents, trademarks, copyrights and business methodologies, are intangible assets, as are goodwill and brand recognition. Expenditure on intangible assets are classed as capital expenditure"
"Purchase Sales invoice (remove ""purchase"" from term)",An invoice to customers who owe debt to the invoicing organisation and is used to recoup these costs
Pay cycle reversal,An off-cycle calculation that reverses the results of a completed pay calculation for a worker
Replacement payment,An off-cycle payment that replaces a worker's on-cycle payment in a period that is in progress or not yet started. You can process replacement payments as part of a manual payment or on demand payment
On demand payment,An off-cycle payment that replaces or is issued in addition to a worker's on-cycle pay
How can I find out which invoices are on hold?,An on hold report is published weekly on the Finance Den.  Please visit the following link for more information:-                             https://educationgovuk.sharepoint.com/sites/lvedfe00083/Shared%20Documents/Forms/AllItems.aspx?RootFolder=%2Fsites%2Flvedfe00083%2FShared%20Documents%2FJET%20%2D%20reports%2FStanding%2FOn%20Hold&FolderCTID=0x01200061C616B77D959B4EA0BB1D282C63546E
Purchase requisition,An on-line form for users to describe to the requisitioner what they need to procure.  Supporting documents can be attached.
What is an operating lease?,An operating lease in the rental of an asset from a lessor. The operating lease concept allows a business to keep from recording an asset on its balance sheets. This type of arrangement is known as off-balance sheet financing
What is an overrun?,"An overrun is when more is spent than was initially planned or budgeted for. If you are concerned about an actual or potential overspend, please contact your Finance Business Partner. 

You can find out who your Finance Business Partner is by reviewing the FBP Directory linked: https://educationgovuk.sharepoint.com/sites/how-do-i/SitePages/finance-business-partners.aspx"
What is an overspend?,"An overspend is when more is spent than was initially planned or budgeted for. If you are concerned about an actual or potential overspend, please contact your Finance Business Partner. 

You can find out who your Finance Business Partner is by reviewing the FBP Directory linked: https://educationgovuk.sharepoint.com/sites/how-do-i/SitePages/finance-business-partners.aspx"
How do I pay a supplier urgently,"An urgent payment is also known as an Outside of Timetable payment. More information can be found here:

https://educationgovuk.sharepoint.com/sites/lvedfe00083/SitePages/Outside-of-Timetable.aspx"
what are annual accounts,"Annual accounts are usually described as “financial accounts”, “company accounts” or “statutory accounts”. Annual accounts provide a comprehensive report of a company's financial activity over the last financial year. DfE's latest accounts can be found here: https://www.gov.uk/government/collections/dfe-annual-reports"
What is AME?,"Annual managed expenditure, or AME, refers to expenditure on programmes which is demand-led – such as welfare, tax credits or public sector pensions.  The expenditure is volatile and is agreed annually with HMT.  It is outside the Spending Review spending controls.  In DfE the common AME budgets are movements on provisions, student loan issues and repayments, ECITB and CITB total expenditure, and Teachers Pensions."
Who do I contact about grant feeder files?,"Any queries around Grant Feeder files should be sent to the following email address PaymentsandData.TEAM@education.gov.uk and or the Operations.P2P@education.gov.uk inbox.
"
What does an Amber/Green rating mean?,"Appropriate evidence and analysis to enable an investment decision to be made by the Investment Committee. There may be recommendations or revisions required to strengthen the case, or some aspects of the case may require more detail, but overall there is sufficient information for the committee to make a decision. In the opinion of the Keyholder, the findings should be relatively easy to address prior to or soon after committee."
How are approvers selected in the system?,Approvers are selected from a list based on value and cost centre. Requisitioners will only be able to select approvers who have the correct limit for a specific cost centre.
How should costs be split?,"As a very basic minimum, financial costs should be split between RDEL and CDEL. Example tables to use can be found at our website here: https://educationgovuk.sharepoint.com/sites/lvedfe00083/SitePages/Keyholder.aspx?web=1"
Does the initial classification of spend need to go to the Cost Classification panel?,"As long as the project is going through the appropriate business case channels, the Cost Classification team can work alongside you in making sure the cost classification decision is robust. However, if the area of spend is novel or contentious the case may need approval from the Cost Classification panel."
What is a finance lease?,"As part of a finance lease, the lessor buys the asset for the lessee and rents it to them for an agreed period. Finance leases are classed as capital expenditure"
What is a debit?,"As part of the double entry accountancy, every entry on a general ledger must have a debit or a credit. A debit refers to an accounting entry recording a sum owed"
Where can I find a finance contact information?,"As well as Delve, you can review the organisation charts on the Finance Den. These can be found here: https://educationgovuk.sharepoint.com/sites/lvedfe00083/SitePages/Org-Charts(1).aspx"
Where can I find out about Assets Under Construction?,Assets Under Construction (AUC) guidance can be found on the Finance DEN here https://educationgovuk.sharepoint.com/sites/lvedfe00083/SitePages/Non-Current%20Assets.aspx
In what instances should I engage with my contract manager?,"At minimum, Category Managers should be engaged for: 
•	business cases and commercial strategies development,
•	market insight and engagement to shape requirements and support delivery, 
•	collaboration to manage projects/programmes through governance processes,
•	identification and management of risk, 
•	drafting innovative invitation to tenders and robust contract clauses including KPI’s/SLA’s 

Please engage with your Directorate Category Manager to support delivery."
Year To Date budget,Available budget from the start of the financial year to the current month
What is a BACS payment?,"BACS (Bank Automated Clearing System) is a system for making electronic payments direct payments between bank accounts. There are two types of BACS payments: direct debits and BACS direct credit.  It is departmental policy to make payments by BACS, apart from some exceptional circumstances e.g. paying other government departments, or ALBs"
Current asset,Balance sheet accounts that represent the value of all assets that can be expected to be converted into cash within one year
Capital budget,"Budget held for capital projects, both within the department and externally"
Programme budget,Budget held for delivery of policy programmes external to the department
Attrition rate,Budget underspend made over the year to the pay bill associated with the natural churn of staff not being in post for 100% of the expected time
Admin Pay budget,Budget used to provide for admin staff salaries and related costs
Admin Non-Pay budget,Budget used to provide for non-admin costs
Departmental Unallocated Provision,"Budget, agreed with HMT and therefore within our overall control total, that has not been allocated to individual budget holders in order to be available as contingency, e.g. for policy (not departmental) emergencies.  It can also hold an overallocation of budget either in line with the risk appetite of leadership team or where we are aware of additional funding coming into the department as part of the supplementary estimates process"
Holiday accrual,Build up of holiday entitlement over the employee's holiday year in proportion to the amount of time of employment in that year
How do we access Business Central?,"Business Central can be accessed via the Finance Den. 

https://educationgovuk.sharepoint.com/sites/lvedfe00083?Profile=Portal/"
What is the benefit of a keyholder review?,"By bringing business cases to the Investment Committee, you will benefit from access to expertise and advice from Directors and DGs; <U+200B>feedback from a range of independent specialists on finance, strategy and commercial teams; greater confidence in your business case and corporate assurance; and the backing of the committee to progress your business case."
When do I need Cabinet Office approval?,"Cabinet Office has many control areas where it will provide approval on, which is to ensure that any such expenditure is necessary and represents value for money. The areas of Cabinet Office control and the exempted bodies are included in this document:
https://www.gov.uk/government/publications/cabinet-office-controls/cabinet-office-controls-guidance-version-40"
What are capital costs?,"Capital costs are fixed, one-time expenses incurred on the purchase of land, buildings, construction, and equipment used in the production of goods or in the rendering of services. In other words, it is the total cost needed to bring a project to a commercially operable status."
what is capital expenditure?,"Capital Expenditure is money spent by a business or organization on acquiring or maintaining fixed assets, such as land, buildings, and equipment."
Are Catalogue (BC) and Category Codes (SOP) the same?,"Catalogue Codes are the same as Category Codes in SOP. Microsoft and Oracle chose to name them differently, so we are moving to the Microsoft naming convention in BC."
Are the Category Codes and lines different to those on SOP?,"Category Codes are now called Catalogue Codes in BC. These are mostly the same as in SOP, with some minor adjustments."
What is CDEL?,"CDEL means ""capital Departmental Expenditure Limit"".  This is money within Departmental Expenditure Limits that is spent on investment and things that will create growth in the future."
What does Central Strategic Finance do?,Central Strategic Finance are responsible for Spending Reviews and other fiscal events; the relationship between HMT and DfE; and future year business and financial planning.
Full year forecast movement,Changes in full year forecast between current month and last month
What is clawback?,Clawback is the process of the Department recovering funds that have been over provided or where there is some residual value
How can I search all of the suppliers in Business Central?,"Click ‘Vendors’ (towards the top left of the Business Central home screen. Click into the ‘Search’ field. You can search by Vendor number, name, UPIN, UKPRN, Companies House Number, or any other field in this list (Scroll from left to right of the page to see them all). To open a specific vendor card, click on the relevant vendor number (left most column)"
who are the commercial team,"Commercial Finance are a specialist team providing expert advice on the financial element of procurements and contracts throughout the Department for Education. More information can be found here:

https://educationgovuk.sharepoint.com/sites/lvedfe00083/SitePages/Commercial-Finance.aspx"
How do l know l have done enough to satisfy audit recommendation?,Consult with the Financial Assurance & Controls Team first before conducting GIAA.  ESFAfinancial.CONTROL@education.gov.uk
"I have a query about an invoice, who can I talk to?",Contact the Accounts Payable  team on accountspayable.BC@education.gov.uk.
Vendor card,"Contains details of the vendor, i.e. name, address, bank details etc."
What are contingent liabilities?,"Contingent liabilities are a legal or moral obligation to meet the financial obligations of a specific guarantee or indemnity where there is a high risk of the liability becoming an actual liability, but it is not a certainty. For example, an indemnity given to cover the cost of re-assessing trainees as a result of flaws in awarding of National Vocational Qualifications by a training board, where it is not known how many (or if at all) trainees will request re-assessment."
Contingent workers,Contractors working on a specific project
What is Contracts Finder?,"Contracts Finder is a platform used across government to publish information about procurement exercises and contract awards.  Publishing information on this platform, is a legal requirement for all government departments.  To ensure ESFA are meeting their obligations, the Commercial Oversight Team seek assurances from Directorates that the relevant information is being published.  This includes call-offs from a framework or Dynamic Purchasing System (DPS), single tenders and other purchase orders:
•	for any contract notice with a value over £10k which ESFA intend to make publicly available (this is in addition to, or instead of, publishing anywhere else)
•	publishing the Contract Award information within 30 days for any awarded contact with a value over £10k.  

 If you have any queries contact: ESFAProcurement.HELP@education.gov.uk This mailbox is reviewed daily.

If you have any questions on the compliance process that will be undertaken by the Commercial Oversight Team, contact Peter Gomez-Luque"
Additional voluntary contribution,Contributions an employee may decide to make to your employer pension scheme to build up an additional retirement fund
Payment elections,"Control how payments are processed for each type of pay that workers receive, such as regular payments and bonus payments. They also control how to handle expense reimbursements for workers. In Workday, Payment Elections refer to Bank Details"
What guidance is there for cost classification?,Cost Classification Guidance can be found here: https://educationgovuk.sharepoint.com/sites/lvedfe00083/SitePages/Group-Accounting-Division.aspx
Why does cost classification matter?,"Cost classification is important since using the wrong budget or cost classification to account for your planned / delivered activities leaves the Department open to the National Audit Office (NAO) and HMT criticism. This could also lead to the expenditure being deemed irregular by the NAO, which in turn could lead the qualification of the Department’s Annual Report and Accounts."
Staff-related cost,Costs associated with current employees
Non-Staff related cost,Costs associated with non-employees
Expenses,Costs incurred. The term may also refer to a set of operations relating to processing of expenses in the department
Court order payments,Court ordered payments recovered from an employee's salary. Court orders are seen as a 3rd party.
What is a criteria based grant?,"Criteria based grants are created with set qualifying criteria. As long as the applicant meets the required criteria, the recipient receives the funding. For example, a grant awarded to all education providers that meet certain criteria. Criteria based grants are not competed. Contact your Finance Business Partner to award a criteria based grant. 

Grant administration guidance can be found here: https://educationgovuk.sharepoint.com/sites/lvedfe00083/SitePages/Grants%20Administration%202.aspx?csf=1&e=cxCHcM. 

For more information on how to process grant funding, please contact DfE.ProgrammePayments@education.gov.uk"
Worker eligibility,Criterion used within the Workday system to establish whether a worker is entitled to a certain benefit or earnings
